{
  "generated_at": "2026-07-22T04:42:33Z",
  "items": {
    "0172de58a453fe0e7e3beff31deaab5f813413fd456954f5e5be8b1452c83344": {
      "card_id": null,
      "content_hash": "fc35d3398939ea9cfd84922940f0a4a1c85131088876ded2b94262492a4c8ce1",
      "feed_id": "finma_news",
      "first_seen": "2026-07-12T08:21:35Z",
      "guid": "{9A28874B-F9BB-4B1A-B121-AE328B74F14C}",
      "item_hash": "0172de58a453fe0e7e3beff31deaab5f813413fd456954f5e5be8b1452c83344",
      "link": "https://www.finma.ch/en/news/2026/04/20260407-sr-946-231-176-72/",
      "published_at": "2026-04-07T08:02:48Z",
      "raw_published": "Tue, 07 Apr 2026 10:02:48 +0200",
      "relevant": false,
      "source_id": "finma",
      "status": "queued",
      "summary": "Das Eidgenössische Departement für Wirtschaft, Bildung und Forschung WBF hat Änderungen der Verordnung vom 4. März 2022 über Massnahmen im Zusammenhang mit der Situation in der Ukraine (SR 946.231.176.72) publiziert.",
      "title": "Aktualisierte Sanktionsmeldung: Russland"
    },
    "073b02d5e2bd3721dfce127c93d1fe3a29acd545ad7e9798091f900c2f3a9009": {
      "card_id": null,
      "content_hash": "f8a23197d04ab8d0c99d34b524bcd5a2349b8c3ce3a8e53607efa4e0869f769d",
      "feed_id": "finma_news",
      "first_seen": "2026-07-12T08:21:35Z",
      "guid": "{0BC53810-16E6-4647-8144-F6BD49A07287}",
      "item_hash": "073b02d5e2bd3721dfce127c93d1fe3a29acd545ad7e9798091f900c2f3a9009",
      "link": "https://www.finma.ch/en/news/2026/06/20260602-sr-946-231-157-5/",
      "published_at": "2026-06-02T14:52:21Z",
      "raw_published": "Tue, 02 Jun 2026 16:52:21 +0200",
      "relevant": false,
      "source_id": "finma",
      "status": "queued",
      "summary": "Das Eidgenössische Departement für Wirtschaft, Bildung und Forschung WBF hat eine Änderung des Anhangs 1 der Verordnung vom 17. Oktober 2018 über Massnahmen gegenüber Myanmar (SR 946.231.157.5) publiziert.",
      "title": "Aktualisierte Sanktionsmeldung: Myanmar"
    },
    "0ac17a5e4f0452d687de01609192f8526fedb9798bb3cdbcca647eb80b3ab0c7": {
      "card_id": null,
      "content_hash": "78b294a1f45028fb93dc49811fd4d67dcd6ebd4ddf4e074fea04b5cb7d4dd95e",
      "feed_id": "finma_news",
      "first_seen": "2026-07-12T08:21:35Z",
      "guid": "{DD1B8744-474C-42F2-AAA5-1168640A3D68}",
      "item_hash": "0ac17a5e4f0452d687de01609192f8526fedb9798bb3cdbcca647eb80b3ab0c7",
      "link": "https://www.finma.ch/en/news/2026/06/20260605-sr-946-231-18/",
      "published_at": "2026-06-05T13:27:43Z",
      "raw_published": "Fri, 05 Jun 2026 15:27:43 +0200",
      "relevant": false,
      "source_id": "finma",
      "status": "queued",
      "summary": "Das Eidgenössische Departement für Wirtschaft, Bildung und Forschung (WBF) hat den Anhang 2 der Verordnung vom 25. Mai 2005 über Massnahmen gegenüber Sudan (SR 946.231.18) geändert.",
      "title": "Aktualisierte Sanktionsmeldung: Sudan"
    },
    "0efcef0fe51d16c094be54e6f0a979fd5064ed6f6f9fbf181d14e7829b10dde3": {
      "card_id": null,
      "content_hash": "5ed634b5a7742e88d93a53f3fd019c10a89c0c167fdfa14e4b3af56b3619c1f1",
      "feed_id": "finma_news",
      "first_seen": "2026-07-12T08:21:35Z",
      "guid": "{741A6944-909D-451A-8BAD-DEEBB9D93EEF}",
      "item_hash": "0efcef0fe51d16c094be54e6f0a979fd5064ed6f6f9fbf181d14e7829b10dde3",
      "link": "https://www.finma.ch/en/news/2026/01/20260129-sr-946-231-139-4/",
      "published_at": "2026-01-29T07:28:55Z",
      "raw_published": "Thu, 29 Jan 2026 08:28:55 +0100",
      "relevant": false,
      "source_id": "finma",
      "status": "queued",
      "summary": "Das Eidgenössische Departement für Wirtschaft, Bildung und Forschung WBF hat eine Änderung des Anhangs der Verordnung vom 16. Dezember 2022 über Massnahmen betreffend Haiti (SR 946.231.139.4) publiziert.&nbsp;",
      "title": "Aktualisierte Sanktionsmeldung: Haiti"
    },
    "11f2234d46aa8ae3c1bdcb32b6d3544bd13d32c04c785ad84eede22ea54431d5": {
      "card_id": null,
      "content_hash": "868e6aac1d154fa1c73a2944c1cd4237d106b811e4f285613983952e28e3316f",
      "feed_id": "finma_news",
      "first_seen": "2026-07-12T08:21:35Z",
      "guid": "{C44EC83E-2786-4ABD-B7BA-2BFD73793729}",
      "item_hash": "11f2234d46aa8ae3c1bdcb32b6d3544bd13d32c04c785ad84eede22ea54431d5",
      "link": "https://www.finma.ch/en/news/2026/07/20260707-mm-liqv-finma/",
      "published_at": "2026-07-07T08:00:00Z",
      "raw_published": "Tue, 07 Jul 2026 10:00:00 +0200",
      "relevant": false,
      "source_id": "finma",
      "status": "queued",
      "summary": "The Swiss Financial Market Supervisory Authority FINMA is incorporating an existing circular on liquidity risks at banks and securities firms to a new ordinance. In doing so it is fulfilling the requirement for the format compliance of regulation in accordance with Article 7 paragraph 1 of the Financial Market Supervision Act.",
      "title": "FINMA publishes a new ordinance on the liquidity of banks and securities firms"
    },
    "1431142be8ebb4afd8054e06830728d03f57b032d63b095ed8769c2c6f51c73f": {
      "card_id": null,
      "content_hash": "d780bbbaf90dec1d530a36bdb52dffb4edfc02d36e7456005851b9c81e51d914",
      "feed_id": "finma_news",
      "first_seen": "2026-07-12T08:21:35Z",
      "guid": "{54083EDC-589D-48CA-8CC3-EE948C6792D1}",
      "item_hash": "1431142be8ebb4afd8054e06830728d03f57b032d63b095ed8769c2c6f51c73f",
      "link": "https://www.finma.ch/en/news/2026/01/20260130-sr-946-231-176-72/",
      "published_at": "2026-01-30T14:58:54Z",
      "raw_published": "Fri, 30 Jan 2026 15:58:54 +0100",
      "relevant": false,
      "source_id": "finma",
      "status": "queued",
      "summary": "Das Eidgenössische Departement für Wirtschaft, Bildung und Forschung WBF hat Änderungen der Verordnung vom 4. März 2022 über Massnahmen im Zusammenhang mit der Situation in der Ukraine (SR 946.231.176.72) publiziert.",
      "title": "Aktualisierte Sanktionsmeldung: Russland"
    },
    "214b4d17c20ea32ed63446bafe3383f1d1d162a0147037ecff186677a2ea474b": {
      "card_id": null,
      "content_hash": "4255a4e7d7aae19959b2eb881d7372212ec6488492d664d0fa28f6075bcc33a4",
      "feed_id": "finma_news",
      "first_seen": "2026-07-12T08:21:35Z",
      "guid": "{401DC633-A88A-46E0-953C-3A8831D51C48}",
      "item_hash": "214b4d17c20ea32ed63446bafe3383f1d1d162a0147037ecff186677a2ea474b",
      "link": "https://www.finma.ch/en/news/2026/06/20260629-mm-durchsetzung-verhaltensregeln/",
      "published_at": "2026-06-29T08:00:00Z",
      "raw_published": "Mon, 29 Jun 2026 10:00:00 +0200",
      "relevant": false,
      "source_id": "finma",
      "status": "queued",
      "summary": "The Swiss Financial Market Supervisory Authority FINMA has concluded enforcement proceedings against two institutions and one individual for serious breaches of the rules of conduct governing the provision of financial services under the FinSA. To restore compliance with the law and protect investors, FINMA ordered various measures. It withdrew Swiss Fund Management AG in liquidation’s licence to manage funds. An application by BZ Berater Zentrum AG for authorisation as an independent portfolio manager was rejected. In addition, FINMA is confiscating millions in illegally generated profits and imposing a multi-year industry ban on one of the individuals responsible.&nbsp;",
      "title": "FINMA concludes proceedings against Swiss Fund Management AG in liquidation and BZ Berater Zentrum AG and enforces rules of conduct in the financial services sector"
    },
    "2bda2b21ca4f1e50bb9be11d58bf741a12b522fb1cf7878ea2be495bb58d432b": {
      "card_id": null,
      "content_hash": "e5c3505bd4f951ef35d837e06747130cdbcdc768a42bc4fe6d2f2aab51db0a39",
      "feed_id": "finma_news",
      "first_seen": "2026-07-12T08:21:35Z",
      "guid": "{A323047E-8324-4C27-A1FA-13637C1F2DE5}",
      "item_hash": "2bda2b21ca4f1e50bb9be11d58bf741a12b522fb1cf7878ea2be495bb58d432b",
      "link": "https://www.finma.ch/en/news/2026/02/20260227-mm-mbaer-liquidation/",
      "published_at": "2026-02-27T14:00:00Z",
      "raw_published": "Fri, 27 Feb 2026 15:00:00 +0100",
      "relevant": false,
      "source_id": "finma",
      "status": "queued",
      "summary": "In enforcement proceedings against MBaer Merchant Bank AG that FINMA concluded three weeks ago and which were recently pending before the Swiss Federal Administrative Court, FINMA had withdrawn the bank's licence. As part of the proceedings, FINMA ascertained that the bank does not have an adequate structure in place for combating money laundering, thus enabling clients to circumvent official asset freezes. The bank has now withdrawn its appeal against the FINMA proceedings, meaning that FINMA’s liquidation order is now effective.&nbsp;",
      "title": "FINMA proceedings: MBaer Merchant Bank AG in liquidation"
    },
    "2c74eac574b6247db912df38014ce404c39624a0a6a1a9831e8b2ce0264b73e7": {
      "card_id": "2c74eac574b6247db912df38014ce404c39624a0a6a1a9831e8b2ce0264b73e7",
      "content_hash": "0ca8a0a417ed8fa283c06faed82d402c3ca89e2079d636a9d6a6381bbe4a3ea1",
      "feed_id": "finma_news",
      "first_seen": "2026-07-12T08:25:30Z",
      "guid": null,
      "item_hash": "2c74eac574b6247db912df38014ce404c39624a0a6a1a9831e8b2ce0264b73e7",
      "link": "https://www.finma.ch/en/news/2024/07/20240726-m-am-06-24-stablecoins/",
      "published_at": "2024-07-26T00:00:00Z",
      "raw_published": "26 Jul 2024",
      "relevant": true,
      "source_id": "finma",
      "status": "published",
      "summary": "FINMA Guidance 06/2024 sets out minimum requirements for banks issuing default guarantees to stablecoin issuers, addressing money-laundering, terrorist-financing, and sanctions-circumvention risks, and building on FINMA's 2019 stablecoin guidance.",
      "title": "FINMA publishes guidance on stablecoins"
    },
    "3153f042c5660f2f366bdbbe5941a0975116506528819bd733f6b50380aa279d": {
      "card_id": null,